{
  "$schema": "https://json-schema.org/draft/2020-12/schema",
  "$id": "https://box-agent.local/schemas/roadmap-draft.schema.json",
  "title": "Box-Agent RoadmapDraft v1",
  "type": "object",
  "additionalProperties": false,
  "required": ["schema_version", "kind", "lanes", "items", "pending_questions"],
  "properties": {
    "schema_version": { "const": 1 },
    "kind": { "const": "roadmap-draft" },
    "title": { "type": "string", "minLength": 1, "maxLength": 120 },
    "range": {
      "type": "object",
      "additionalProperties": false,
      "properties": {
        "start": { "$ref": "#/$defs/plainDate" },
        "end": { "$ref": "#/$defs/plainDate" },
        "granularity": { "const": "half-month" }
      }
    },
    "lanes": {
      "type": "array",
      "items": {
        "type": "object",
        "additionalProperties": false,
        "required": ["label", "order", "raw", "source"],
        "properties": {
          "id": { "$ref": "#/$defs/stableId" },
          "label": { "type": "string", "minLength": 1, "maxLength": 60 },
          "order": { "type": "integer", "minimum": 1 },
          "raw": { "type": "object" },
          "source": { "$ref": "#/$defs/source" }
        }
      }
    },
    "items": {
      "type": "array",
      "items": {
        "type": "object",
        "additionalProperties": false,
        "required": ["lane_ref", "title", "kind", "progress", "raw", "source"],
        "properties": {
          "id": { "$ref": "#/$defs/stableId" },
          "lane_ref": { "type": "string", "minLength": 1 },
          "title": { "type": "string", "minLength": 1, "maxLength": 100 },
          "start": { "$ref": "#/$defs/plainDate" },
          "end": { "$ref": "#/$defs/plainDate" },
          "kind": { "enum": ["bar", "milestone"] },
          "certainty": { "enum": ["confirmed", "tentative"] },
          "progress": { "enum": ["planned", "doing", "done", "blocked"] },
          "continuation": { "$ref": "#/$defs/continuation" },
          "color": { "type": "string", "maxLength": 40 },
          "detail": { "type": "string", "maxLength": 500 },
          "raw": { "type": "object" },
          "source": { "$ref": "#/$defs/source" }
        }
      }
    },
    "pending_questions": {
      "type": "array",
      "items": {
        "type": "object",
        "additionalProperties": false,
        "required": ["field_path", "prompt"],
        "properties": {
          "field_path": { "type": "string", "minLength": 1 },
          "prompt": { "type": "string", "minLength": 1 },
          "reason": { "type": "string" }
        }
      }
    }
  },
  "$defs": {
    "plainDate": {
      "type": "string",
      "anyOf": [
        {
          "pattern": "^(?:0[1-9][0-9]{2}|[1-9][0-9]{3})-(?:(?:01|03|05|07|08|10|12)-(?:0[1-9]|[12][0-9]|3[01])|(?:04|06|09|11)-(?:0[1-9]|[12][0-9]|30)|02-(?:0[1-9]|1[0-9]|2[0-8]))$"
        },
        {
          "pattern": "^(?:(?:0[1-9]|[1-9][0-9])(?:0[48]|[2468][048]|[13579][26])|(?:0[48]|[2468][048]|[13579][26])00)-02-29$"
        }
      ]
    },
    "stableId": { "type": "string", "pattern": "^[a-zA-Z0-9][a-zA-Z0-9_-]{0,63}$" },
    "continuation": {
      "type": "object",
      "additionalProperties": false,
      "properties": {
        "before": { "const": true },
        "after": { "const": true }
      },
      "minProperties": 1
    },
    "source": {
      "type": "object",
      "additionalProperties": false,
      "required": ["type", "confidence"],
      "properties": {
        "type": { "enum": ["natural-language", "table", "image", "roadmap-spec"] },
        "confidence": { "type": "number", "minimum": 0, "maximum": 1 },
        "field_confidence": {
          "type": "object",
          "additionalProperties": { "type": "number", "minimum": 0, "maximum": 1 }
        },
        "excerpt": { "type": "string", "maxLength": 500 },
        "row": { "type": "integer", "minimum": 1 },
        "column": { "type": "string", "minLength": 1 },
        "region": {
          "type": "array",
          "prefixItems": [
            { "type": "number", "minimum": 0 },
            { "type": "number", "minimum": 0 },
            { "type": "number", "exclusiveMinimum": 0 },
            { "type": "number", "exclusiveMinimum": 0 }
          ],
          "items": false,
          "minItems": 4,
          "maxItems": 4
        },
        "page": { "type": "integer", "minimum": 1 },
        "field_path": { "type": "string", "minLength": 1 }
      },
      "allOf": [
        {
          "if": { "properties": { "type": { "const": "table" } }, "required": ["type"] },
          "then": { "required": ["row"] }
        },
        {
          "if": { "properties": { "type": { "const": "image" } }, "required": ["type"] },
          "then": { "required": ["region"] }
        },
        {
          "if": { "properties": { "type": { "const": "roadmap-spec" } }, "required": ["type"] },
          "then": { "required": ["field_path"] }
        }
      ]
    }
  }
}
